{
  "$schema": "../docs/schemas/deployment.schema.json",
  "schemaVersion": 1,
  "network": {
    "name": "creditcoin-cc3-testnet",
    "chainId": 102031,
    "rpcUrl": "https://rpc.cc3-testnet.creditcoin.network"
  },
  "source": {
    "gitCommit": "83c7556da3ede5c317b14a347604f8b05c864227",
    "solc": "0.8.28",
    "optimizerRuns": 200,
    "evmVersion": "london"
  },
  "accounts": {
    "deployer": "0x139BF8FCB6BCd2Fa169488Ace6a302cc1CA68B29",
    "underwriter": "0xc8b887bd108c859291d590D4f89D1B569F8EDC62",
    "treasury": "0x139BF8FCB6BCd2Fa169488Ace6a302cc1CA68B29",
    "policyholder": "0x3dFF45B4abECe2a5Fafce69A9eF19612F78f334c"
  },
  "roles": {
    "defaultAdmin": "0xc8b887bd108c859291d590D4f89D1B569F8EDC62",
    "underwriter": "0xc8b887bd108c859291d590D4f89D1B569F8EDC62"
  },
  "dependencies": {
    "blockProver": {
      "address": "0x0000000000000000000000000000000000000FD2",
      "codeHash": null,
      "precompile": true
    },
    "chainInfo": {
      "address": "0x0000000000000000000000000000000000000fd3",
      "codeHash": null,
      "precompile": true
    },
    "decoder": {
      "address": "0x731c345d79Fb8BbDC541f9DF3b6317585F849F9f",
      "codeHash": "0xb549c9d8eaf7d361192f8e363fe98717464441e2dd26e2b3bd1e0725df73a065",
      "precompile": false
    },
    "sourceAggregator": {
      "address": "0xc9E1a09622afdB659913fefE800fEaE5DBbFe9d7",
      "codeHash": "0x16f41184f797cb8f8918680df0ebf2a97cc3192aa6b104615f61096fc674f2aa",
      "precompile": false
    }
  },
  "contracts": {
    "testUSD": {
      "address": "0xf79caedff7a2e4349f1a86fa39da151151d8afc8",
      "txHash": "0x36d678747ea191aa8a5587ec1d662be08bf6f82c2877fc5c89b708e646655092",
      "blockNumber": 5469890,
      "codeHash": "0x84be5f0969dfefc268d971ef2ae74cdb1cbfc16203451d8d9b01630e18dd12f3"
    },
    "adapter": {
      "address": "0x07a87e5a533c0d39eb716dc38afd32b8701c2dd9",
      "txHash": "0x16781024995889fd6c22f089e51066af746f603e1917d783bc06e5a87a2ec078",
      "blockNumber": 5469891,
      "codeHash": "0xfe5bb8de34cfedda4876b5fade5ffaced4433753c7e8dfe0ae8bf0b7dc074917"
    },
    "pool": {
      "address": "0x53712c0cd4edfce30331a7aeac933086ab47c711",
      "txHash": "0x3b0c0360eb064227a2d0c9f4050fcb3219c8d7b4b42408401e937855ee2a30b7",
      "blockNumber": 5469892,
      "codeHash": "0x228ec47e4e22668206b83c0789b80a46ab45d7ba2f8aeccefafa7195f8682686"
    }
  },
  "product": {
    "id": "1",
    "creationTxHash": "0xca336649b66f5823789f4741283fa4c82624a25110a38416e5746261f358fe3b",
    "chainKey": "3",
    "aggregator": "0xc9E1a09622afdB659913fefE800fEaE5DBbFe9d7",
    "feedDecimals": 8,
    "triggerBelow": "100983312",
    "activationDelay": 300,
    "policyDuration": 604800,
    "claimGracePeriod": 21600,
    "minBreachDuration": 300,
    "premiumBps": 250,
    "maxCoveragePerPolicy": "500000000",
    "demoOnly": true
  },
  "demoPolicy": {
    "id": "1",
    "purchaseTxHash": "0x39359aab37bc067b62bd224dde98f05407bf72dbb90e19053a72dfe0ce0512f2",
    "purchaseBlockNumber": 5469918,
    "holder": "0x3dFF45B4abECe2a5Fafce69A9eF19612F78f334c",
    "beneficiary": "0x3dFF45B4abECe2a5Fafce69A9eF19612F78f334c",
    "coverage": "100000000",
    "premium": "2500000",
    "purchasedAt": 1789139685,
    "startsAt": 1789139985,
    "endsAt": 1789744785,
    "state": 0
  },
  "deployedAt": "2026-09-11T15:07:45.000Z"
}
