{
  "$schema": "../docs/schemas/deployment.schema.json",
  "schemaVersion": 1,
  "network": {
    "name": "creditcoin-cc3-testnet",
    "chainId": 102031,
    "rpcUrl": "https://rpc.cc3-testnet.creditcoin.network"
  },
  "source": {
    "gitCommit": "a8792233ca8ac4f9efd6e51d9b67a9051f2b12f3",
    "solc": "0.8.28",
    "optimizerRuns": 200,
    "evmVersion": "london"
  },
  "accounts": {
    "deployer": "0x139BF8FCB6BCd2Fa169488Ace6a302cc1CA68B29",
    "underwriter": "0xc8b887bd108c859291d590D4f89D1B569F8EDC62",
    "treasury": "0x139BF8FCB6BCd2Fa169488Ace6a302cc1CA68B29",
    "policyholder": "0x3dFF45B4abECe2a5Fafce69A9eF19612F78f334c"
  },
  "roles": {
    "defaultAdmin": "0xc8b887bd108c859291d590D4f89D1B569F8EDC62",
    "underwriter": "0xc8b887bd108c859291d590D4f89D1B569F8EDC62"
  },
  "dependencies": {
    "blockProver": {
      "address": "0x0000000000000000000000000000000000000FD2",
      "codeHash": null,
      "precompile": true
    },
    "chainInfo": {
      "address": "0x0000000000000000000000000000000000000fd3",
      "codeHash": null,
      "precompile": true
    },
    "decoder": {
      "address": "0x731c345d79Fb8BbDC541f9DF3b6317585F849F9f",
      "codeHash": "0xb549c9d8eaf7d361192f8e363fe98717464441e2dd26e2b3bd1e0725df73a065",
      "precompile": false
    },
    "sourceAggregator": {
      "address": "0xc9E1a09622afdB659913fefE800fEaE5DBbFe9d7",
      "codeHash": "0x16f41184f797cb8f8918680df0ebf2a97cc3192aa6b104615f61096fc674f2aa",
      "precompile": false
    }
  },
  "contracts": {
    "testUSD": {
      "address": "0x02cc01bd58334e6a011e1fb7b094a00493a10d43",
      "txHash": "0x5a20dc9ce1e9140b86a1c7ef05ee67c4ae524b51ad5074e05a79df3dcb20c6c0",
      "blockNumber": 5413946,
      "codeHash": "0x749dfdd8fb8a779416b810e9486f77eaa2700b73de1126afad49ec6bca3bd98a"
    },
    "adapter": {
      "address": "0x1bc5b5b6cba95d552a0f8053b7be753c28cd0060",
      "txHash": "0x99739aeffffaf3e1d07dab0e782bc6f6be532b7c9522746cc4c9a72e16a0012c",
      "blockNumber": 5413947,
      "codeHash": "0x26036f79c387f0183dd4befbe250f5e2a2fdebc7025051a3dc4ff0b5cfdaab8d"
    },
    "pool": {
      "address": "0x0ff95da30f07a79c648780583907bd1b6a659d03",
      "txHash": "0x79d4df5568436e934c7ea1e74145c74ea9b9bd231a56a173d5405a877b08a569",
      "blockNumber": 5413948,
      "codeHash": "0x02a53739660eca73484e6b3ab0c5555d96d9d9c397ec1083987f5878aaa98ed5"
    }
  },
  "product": {
    "id": "1",
    "creationTxHash": "0x9f95712d32825a6abcf7581fd533db5b7c87aaf2c150fc24522b3fc9fa91d599",
    "chainKey": "3",
    "aggregator": "0xc9E1a09622afdB659913fefE800fEaE5DBbFe9d7",
    "feedDecimals": 8,
    "triggerBelow": "100989675",
    "activationDelay": 30,
    "policyDuration": 3600,
    "claimGracePeriod": 1800,
    "minBreachDuration": 300,
    "premiumBps": 250,
    "maxCoveragePerPolicy": "500000000",
    "demoOnly": true
  },
  "demoPolicy": {
    "id": "1",
    "purchaseTxHash": "0x6393a96e3534e4e9865a3c0f13c089f738b1fc9ef825319f27f3420bf7031472",
    "purchaseBlockNumber": 5413975,
    "holder": "0x3dFF45B4abECe2a5Fafce69A9eF19612F78f334c",
    "beneficiary": "0x3dFF45B4abECe2a5Fafce69A9eF19612F78f334c",
    "coverage": "100000000",
    "premium": "2500000",
    "purchasedAt": 1788298665,
    "startsAt": 1788298695,
    "endsAt": 1788302295,
    "state": 0
  },
  "deployedAt": "2026-09-01T21:30:30.000Z"
}
